{"schema":"learning-roadmap/topic/v1","id":"cp-gateway","title":"Чекпоинт — единый шлюз к трём моделям с замером и фолбэком","stage":1,"depends_on":["local-runtime","openai-compatible-api","tokens-context-cost","structured-output","model-selection","provider-routing"],"est_hours":[2,3],"volatility":"volatile","revalidate_after_days":90,"verified_at":"2026-07-26","confidence":"medium","retention":"by_use","version_context":["ollama","llama_cpp","litellm","promptfoo","anthropic_api_version"],"outcomes":["Может собрать из разрозненных кусков этапа один рабочий контур - локальная модель и облако\nза общим эндпоинтом, вывод принуждён схемой, качество и стоимость померены на своём наборе,\nотказ первичного провайдера не роняет клиента.\n","Может объяснить на своём же артефакте, какой ресурс тратится в каждой точке контура -\nпамять под KV-кэш локально и деньги за токены в облаке - и показать это числами из логов.\n"],"misconceptions":[],"materials":[],"practice":{"kind":"ops","tier":"P3","time_box_min":180,"task":"Собери один контур из всего, что делал на этапе, и докажи его работоспособность числами.\n\nКонтур должен состоять из четырёх частей.\n\n1. Локальный рантайм. Ollama или llama-server, поднятый нативно (не в Docker - на macOS\n   контейнер не получит GPU). Размер контекста задан ЯВНО, а не унаследован по умолчанию.\n\n2. Шлюз. LiteLLM proxy на http://0.0.0.0:4000 с config.yaml, где под одним model_name\n   лежат минимум два деплоймента - локальный и облачный - и настроены fallbacks\n   и num_retries. Клиентский код знает ровно один base_url и не содержит ни одного\n   литерального ключа.\n\n3. Принуждённый вывод. Задача контура - извлечение структуры, а не свободный текст.\n   Возьми свою реальную задачу (например, разбор заметки в набор полей) и опиши её одной\n   JSON-схемой. Оба деплоймента обязаны отдавать выход, проходящий валидацию этой схемой.\n\n4. Замер. Набор из минимум 10 своих кейсов в promptfooconfig.yaml, где среди ассертов есть\n   и проверка схемы, и порог по стоимости, и порог по латентности.\n\nДоказать нужно три вещи.\n\nA. Контур работает через шлюз - клиент ходит на один адрес и получает валидный по схеме\n   ответ.\nB. Фолбэк реально срабатывает - при физически погашенном первичном деплойменте тот же\n   клиентский запрос по-прежнему возвращает 200 и валидный по схеме ответ.\nC. Замер даёт бинарный вердикт - promptfoo eval завершается нулевым кодом, когда пороги\n   выдержаны, и ненулевым, когда ты намеренно ужесточаешь порог до недостижимого.\n\nОтдельно приложи короткий разбор бюджета ресурсов - на чём именно тратится память\nлокально и на чём деньги в облаке, с конкретными числами из вывода ollama ps и из полей\nusage облачного ответа.\n","deliverable":"Каталог gateway-checkpoint со следующим содержимым.\n\n- config.yaml шлюза\n- client.py или client.mjs - единственный клиентский файл, один base_url, ключей нет\n- schema.json - схема принуждённого вывода\n- promptfooconfig.yaml - минимум 10 кейсов, ассерты на схему, стоимость и латентность\n- budget.md - разбор бюджета ресурсов с числами из ollama ps и из usage\n- run-log.md - вывод команд, доказывающих пункты A, B и C, с отметкой, что именно было\n  погашено при проверке фолбэка\n","starting_point":"Артефакты собственных практик топиков этапа 1. Новый код писать не нужно - задача в том,\nчтобы куски заработали вместе.\n","constraints":[{"id":"c1","claim":"Клиентский файл содержит ровно один base_url и ни одного литерального ключа API.\n","check":"bash -c 'grep -cE \"base_url|baseURL\" gateway-checkpoint/client.* ; grep -nEi \"sk-[a-zA-Z0-9]{16,}|api[_-]?key[\\\"'\"'\"']?\\s*[:=]\\s*[\\\"'\"'\"'][^\\\"'\"'\"$]{12,}\" gateway-checkpoint/client.* || echo NO_LITERAL_KEYS'\n","expect":"Первое число равно 1, вторая команда печатает NO_LITERAL_KEYS.\n"},{"id":"c2","claim":"В конфиге шлюза присутствуют и fallbacks, и num_retries, и минимум два деплоймента.\n","check":"bash -c 'grep -c \"fallbacks\" gateway-checkpoint/config.yaml ; grep -c \"num_retries\" gateway-checkpoint/config.yaml ; grep -c \"litellm_params\" gateway-checkpoint/config.yaml'\n","expect":"Первые два числа не меньше 1, третье не меньше 2.\n"},{"id":"c3","claim":"Набор для замера содержит минимум 10 кейсов и не опирается на один только llm-rubric.\n","check":"bash -c 'grep -cE \"^\\s*-\\s*(vars|description):\" gateway-checkpoint/promptfooconfig.yaml ; grep -cE \"is-json|javascript|cost|latency\" gateway-checkpoint/promptfooconfig.yaml'\n","expect":"Первое число не меньше 10, второе не меньше 3.\n"}],"acceptance":[{"id":"a1","claim":"Клиент ходит через шлюз и получает ответ, валидный по своей же схеме.\n","check":"bash -c 'cd gateway-checkpoint && python client.py > out.json 2>err.txt; python -c \"import json,jsonschema,sys; jsonschema.validate(json.load(open(\\\"out.json\\\")), json.load(open(\\\"schema.json\\\"))); print(\\\"SCHEMA_OK\\\")\"'\n","expect":"Печатается SCHEMA_OK, исключения нет.\n"},{"id":"a2","claim":"При погашенном первичном деплойменте тот же запрос всё равно отрабатывает.\n","check":"bash -c 'cd gateway-checkpoint && grep -q \"OLLAMA_DOWN\\|primary down\\|погашен\" run-log.md && grep -qE \"HTTP/[0-9.]+ 200|\\\"status\\\": *200|200 OK\" run-log.md && echo FALLBACK_PROVEN'\n","expect":"Печатается FALLBACK_PROVEN.\n"},{"id":"a3","claim":"Замер даёт бинарный вердикт в обе стороны - зелёный при выдержанных порогах\nи красный при намеренно недостижимом пороге.\n","check":"bash -c 'cd gateway-checkpoint && npx promptfoo@latest eval -c promptfooconfig.yaml >/dev/null 2>&1; echo \"PASS_EXIT=$?\"'\n","expect":"PASS_EXIT=0 на исходных порогах. В run-log.md должен быть зафиксирован и второй прогон,\nгде порог ужесточён и код выхода ненулевой.\n"},{"id":"a4","claim":"Разбор бюджета опирается на фактические числа, а не на общие слова.\n","check":"bash -c 'grep -cE \"[0-9]+ *(GiB|GB|MB|MTok|токен|tokens)\" gateway-checkpoint/budget.md ; grep -cE \"input_tokens|output_tokens|cache_read_input_tokens\" gateway-checkpoint/budget.md'\n","expect":"Первое число не меньше 3, второе не меньше 1.\n"}],"smoke_checked":false,"fallback":"Спуск с P3 не производился - пороги стоимости и латентности измеримы через ассерты\npromptfoo, а срабатывание фолбэка проверяется кодом ответа при физически погашенном\nпервичном деплойменте. Если на момент выполнения платный ключ недоступен, разрешается\nзаменить облачный деплоймент вторым локальным на другом порту - тогда пункт про стоимость\nзаменяется на порог по латентности, а разбор бюджета в budget.md ограничивается памятью.\nЭто единственное разрешённое послабление, и оно должно быть явно отмечено в run-log.md.\n"},"questions":[],"exam":{"focus":"Собираются ли куски этапа в один работающий контур и понимает ли человек, какой ресурс\nтратится в каждой его точке. Проверяется не знание отдельных инструментов, а способность\nобъяснить свой собственный артефакт - почему шлюз настроен именно так, что произойдёт\nпри отказе каждого звена и откуда взялись числа в разборе бюджета.\n","traps":["Попросить показать, что фолбэк сработал, и посмотреть, не выдаёт ли человек за\nдоказательство обычный успешный запрос без погашения первичного деплоймента.\n","Спросить, что изменится в контуре, если поднять контекст локальной модели вчетверо -\nкупится ли на ответ про скорость, не назвав рост KV-кэша и риск вытеснения на CPU.\n","Предложить убрать проверку схемы из ассертов, раз выход и так принуждён грамматикой,\nи посмотреть, вспомнит ли человек про облачный деплоймент и про отказ по безопасности.\n","Спросить, спасёт ли настроенный fallbacks от ситуации, когда модель вернула валидный\nпо схеме, но содержательно неверный ответ.\n"],"artifact_required":true,"max_exchanges":9}}